{
  "$schema": "./schema-v1.json",
  "schema_version": 1,
  "kind": "amt_augmentor_research_reference",
  "reference_id": "galdr-hardanger-v1",
  "status": "complete",
  "title": "Galdr Hardanger fiddle augmentation validation results",
  "summary": "Completed epoch-150 results from the prespecified original-versus-conventional checkpoint campaign, plus fixed-checkpoint leave-one-family-out, targeted successor, preference, recipe, and late-training interaction experiments with the compact Galdr AMT model.",
  "package_policy": {
    "changes_runtime_defaults": false,
    "recipe_status": "dataset_specific_evidence",
    "guidance": [
      "Use these results to form hypotheses for a corpus with similar recording and instrument characteristics.",
      "Choose transform strengths and exposure schedules for the target corpus and validate them on untouched held-out source groups.",
      "Do not treat the best Galdr arm as an AMT-Augmentor package default."
    ]
  },
  "scope": {
    "evidence_level": "single_seed_validation",
    "dataset": "hf2-group-v2",
    "domain": "historical and contemporary Hardanger fiddle recordings",
    "training_source_count": 107,
    "validation_units": {
      "kind": "tune-disjoint canonical tunes",
      "count": 6
    },
    "random_seeds": [424242],
    "selection_partition": "validation",
    "test_data_accessed": false,
    "checkpoint_selection": "The O/C campaign evaluated 30 prespecified candidate epochs with a fixed winner rule; this card reports its fixed epoch-150 rows. All other result sets report their protocol-specified fixed epochs without checkpoint search.",
    "publication_status": "manuscript in preparation"
  },
  "artifact_bases": [
    {
      "id": "galdr-protocol-source",
      "kind": "git_repository",
      "uri": "git@github.com:LarsMonstad/galdr-sigma2.git",
      "revision": "fa8028e13b90145c569624a1162ccfd3e46186a1",
      "availability": "unpublished",
      "locator_prefixes": ["configs/"],
      "immutability": "Every listed config resolves under this exact local Git revision and is additionally bound by its per-artifact SHA-256. The revision is not currently reachable from a public remote."
    },
    {
      "id": "galdr-runtime-artifacts",
      "kind": "logical_artifact_root",
      "uri": "galdr-artifact://galdr-sigma2-runtime/",
      "revision": null,
      "availability": "unpublished",
      "locator_prefixes": ["runs/", "evaluations/", "summaries/"],
      "immutability": "The runtime store is not redistributed; each locator is immutable for this card through its required per-artifact SHA-256."
    }
  ],
  "software_provenance": [
    {
      "name": "Galdr",
      "role": "Protocol control source",
      "revision": "fa8028e13b90145c569624a1162ccfd3e46186a1",
      "revision_scope": "This local, currently unpublished control revision contains byte-identical copies of every listed protocol config; it is a reconstruction/audit binding, not a claim that every historical run executed from this one revision."
    },
    {
      "name": "AMT-Augmentor",
      "role": "Paired augmentation materialization",
      "revision": null,
      "revision_scope": "The Galdr protocols span evolving source trees, so this card does not invent one historical AMT-Augmentor revision. Exact runtime and materialization source bindings remain in the hash-bound upstream protocol and completion artifacts."
    }
  ],
  "metric_definitions": [
    {
      "id": "tune_macro_onset_f1",
      "label": "Onset F1",
      "unit": "fraction",
      "aggregation": "macro mean over six tunes against untouched canonical expert MIDI",
      "range": [0.0, 1.0]
    },
    {
      "id": "tune_macro_onset_offset_f1",
      "label": "Onset plus offset F1",
      "unit": "fraction",
      "aggregation": "macro mean over six tunes against untouched canonical expert MIDI",
      "range": [0.0, 1.0]
    }
  ],
  "protocols": [
    {
      "id": "compact-original-vs-conventional-e150",
      "question": "Does the conventional six-view augmentation package improve the compact model over original-only training at the same fixed training horizon?",
      "design": "Both arms use seed 424242, 150 epochs, 36000 optimizer updates, the same source-disjoint split, and the same evaluation. The update budget is matched; O repeatedly samples originals while C samples one original and five transformed logical views. The campaign evaluated 30 prespecified candidates at five-epoch intervals; the observations in this card are the fixed epoch-150 rows, not winner-selected scores.",
      "model": {
        "name": "Galdr compact",
        "parameters": 2524335,
        "configuration_sha256": "1200896ea199f457ed5805c373ba32562698df8fa356cfb7380361981a4c110a"
      },
      "training": {
        "seed": 424242,
        "epochs": 150,
        "optimizer_steps": 36000,
        "optimizer_steps_per_epoch": 240,
        "effective_batch_size": 80,
        "chunk_seconds": 16.0
      },
      "evaluation": {
        "partition": "validation",
        "reported_epoch": 150,
        "reported_row_role": "fixed epoch-150 member of the prespecified candidate grid",
        "candidate_epochs": [5, 10, 15, 20, 25, 30, 35, 40, 45, 50, 55, 60, 65, 70, 75, 80, 85, 90, 95, 100, 105, 110, 115, 120, 125, 130, 135, 140, 145, 150],
        "winner_rule": ["highest full-precision tune-macro onset-plus-offset F1", "exact tie: highest full-precision tune-macro onset-only F1", "exact tie: earliest optimizer update"],
        "test_inference": false
      },
      "arms": [
        {
          "id": "o",
          "label": "Original-only",
          "transform_families": [],
          "description": "Original recordings only."
        },
        {
          "id": "c",
          "label": "Full conventional package",
          "transform_families": ["gain_chorus_v1", "noise_snr_v1", "reverb_filters_v1", "pitch_shift_v1", "time_stretch_v1"],
          "description": "One original logical view plus one view from each of five conventional transform families.",
          "logical_exposure": {
            "original": 1,
            "gain_chorus_v1": 1,
            "noise_snr_v1": 1,
            "reverb_filters_v1": 1,
            "pitch_shift_v1": 1,
            "time_stretch_v1": 1
          }
        }
      ],
      "source_artifacts": [
        {
          "role": "training protocol",
          "locator": "configs/training/compact-oc-s424242-e150-v1.json",
          "sha256": "d1bb8cdc70801fa84d3d9ed65d8fc26e18c04819803e51793d38527080e1d40c",
          "included": false
        }
      ]
    },
    {
      "id": "conventional-lofo-e150",
      "question": "Which family contributes inside the dense conventional package?",
      "design": "Each omitted-family arm replaces that family's logical slot with the original view. Source, window, logical-slot draw count, optimizer updates, initialization seed, and evaluation are controlled. The contrast is conditional on the remaining dense package.",
      "model": {
        "name": "Galdr compact",
        "parameters": 2524335
      },
      "training": {
        "seed": 424242,
        "epochs": 150,
        "optimizer_steps": 36000,
        "logical_views": 6
      },
      "evaluation": {
        "partition": "validation",
        "fixed_epoch": 150,
        "checkpoint_search": false,
        "test_inference": false
      },
      "arms": [
        {"id": "c-full", "label": "Full conventional package", "transform_families": ["gain_chorus_v1", "noise_snr_v1", "reverb_filters_v1", "pitch_shift_v1", "time_stretch_v1"], "description": "The six-view conventional reference."},
        {"id": "c-minus-gain-chorus", "label": "Minus gain/chorus", "transform_families": ["noise_snr_v1", "reverb_filters_v1", "pitch_shift_v1", "time_stretch_v1"], "description": "Gain/chorus slot replaced by original."},
        {"id": "c-minus-noise", "label": "Minus Gaussian noise", "transform_families": ["gain_chorus_v1", "reverb_filters_v1", "pitch_shift_v1", "time_stretch_v1"], "description": "Generic Gaussian-noise slot replaced by original."},
        {"id": "c-minus-reverb-filters", "label": "Minus reverb/filters", "transform_families": ["gain_chorus_v1", "noise_snr_v1", "pitch_shift_v1", "time_stretch_v1"], "description": "Combined reverb/filter slot replaced by original."},
        {"id": "c-minus-pitch-shift", "label": "Minus pitch shift", "transform_families": ["gain_chorus_v1", "noise_snr_v1", "reverb_filters_v1", "time_stretch_v1"], "description": "Pitch-shift slot replaced by original."},
        {"id": "c-minus-time-stretch", "label": "Minus time stretch", "transform_families": ["gain_chorus_v1", "noise_snr_v1", "reverb_filters_v1", "pitch_shift_v1"], "description": "Global time-stretch slot replaced by original."}
      ],
      "source_artifacts": [
        {
          "role": "base ablation protocol",
          "locator": "configs/training/augmentation-ablation-lofo-s424242-e100-v2.json",
          "sha256": "2e617bb217baef312bf862abc8477c0d25a7b1d338421dfa1dcc92dffb3432a1",
          "included": false
        },
        {
          "role": "epoch-150 extension protocol",
          "locator": "configs/training/augmentation-ablation-lofo-s424242-e150-extension-v1.json",
          "sha256": "3efbb4fcb33b139623dd3b20e7de7aedd0b78f614abd996d66c6c0dc0ca294a3",
          "included": false
        }
      ]
    },
    {
      "id": "successor-methods-e100-e150",
      "question": "Does archival noise/hum or fractional detuning improve on its slot-matched omitted-family control?",
      "design": "Each candidate replaces only the duplicated-original slot in its paired leave-one-family-out control. Source, window, and logical-slot draws are identical within each pair, with six views and a fixed update budget.",
      "model": {"name": "Galdr compact", "parameters": 2524335},
      "training": {"seed": 424242, "epochs": 150, "optimizer_steps": 36000, "logical_views": 6},